{
  "metadata": {
    "artifact_type": "leakage_audit_report",
    "artifact_version": "1.0.0",
    "schema_version": "1.0.0",
    "batch_id": "glossary_batch_001_data_analyst_pilot",
    "run_id": "leakage_check_c4_20250115",
    "prompt_version": "13_leakage_check@v1",
    "model": "us.anthropic.claude-opus-4-5-20251101-v1:0,us.anthropic.claude-opus-4-6-v1",
    "generated_at": "2025-01-15T00:00:00Z",
    "source_snapshot_id": "glossary_batch_001_data_analyst_pilot",
    "parent_artifact_hashes": {
      "glossary_bundles_draft.part.c4.json": "ef046e650196dab2d547be1926e6e22af3b814fbdc38338314606ceee31f0d74",
      "coverage_briefs.part.c4.json": "665bdee2dd5637e5fbc2821eba169f07d793342be0945a1f01577612b111e16c",
      "extracted_concepts.json": "8e3969d65e33ee46f6e3ca399cf9ada942a5b349eb85f07e6b5d60dfe6acdc8e"
    }
  },
  "batch_id": "glossary_batch_001_data_analyst_pilot",
  "reviewed_bundle_ids": [
    "spreadsheet.grid_model:data_analyst",
    "spreadsheet.cell_references_ranges:data_analyst",
    "spreadsheet.structured_tables:data_analyst",
    "spreadsheet.named_ranges:data_analyst",
    "spreadsheet.sorting:data_analyst",
    "spreadsheet.filtering:data_analyst",
    "spreadsheet.conditional_formatting:data_analyst",
    "spreadsheet.data_validation:data_analyst",
    "spreadsheet.remove_duplicates_cleaning:data_analyst",
    "spreadsheet.text_to_columns_split:data_analyst",
    "spreadsheet.cross_sheet_references:data_analyst",
    "spreadsheet.formula_syntax:data_analyst",
    "spreadsheet.relative_absolute_references:data_analyst",
    "spreadsheet.aggregation_functions:data_analyst",
    "spreadsheet.logical_functions:data_analyst",
    "spreadsheet.text_combining:data_analyst",
    "spreadsheet.text_extraction:data_analyst",
    "spreadsheet.date_functions:data_analyst",
    "spreadsheet.conditional_aggregation:data_analyst",
    "spreadsheet.vlookup_xlookup:data_analyst",
    "spreadsheet.index_match:data_analyst",
    "spreadsheet.formula_error_troubleshooting:data_analyst",
    "spreadsheet.pivot_tables:data_analyst",
    "spreadsheet.pivot_summarization:data_analyst",
    "spreadsheet.bar_chart_creation:data_analyst",
    "spreadsheet.line_chart_creation:data_analyst",
    "spreadsheet.pie_chart_creation:data_analyst",
    "stats.ab_test_structure:data_analyst",
    "stats.lift_interpretation:data_analyst",
    "stats.sample_size_effect_concept:data_analyst",
    "stats.significance_confidence_concept:data_analyst",
    "stats.business_conclusion_from_experiment:data_analyst"
  ],
  "reviews": [
    {
      "concept_id": "spreadsheet.grid_model",
      "path_id": "data_analyst",
      "leaked_concepts": [],
      "unsupported_claims": [],
      "blocking": false
    },
    {
      "concept_id": "spreadsheet.cell_references_ranges",
      "path_id": "data_analyst",
      "leaked_concepts": [],
      "unsupported_claims": [],
      "blocking": false
    },
    {
      "concept_id": "spreadsheet.structured_tables",
      "path_id": "data_analyst",
      "leaked_concepts": [],
      "unsupported_claims": [],
      "blocking": false
    },
    {
      "concept_id": "spreadsheet.named_ranges",
      "path_id": "data_analyst",
      "leaked_concepts": [],
      "unsupported_claims": [],
      "blocking": false
    },
    {
      "concept_id": "spreadsheet.sorting",
      "path_id": "data_analyst",
      "leaked_concepts": [],
      "unsupported_claims": [],
      "blocking": false
    },
    {
      "concept_id": "spreadsheet.filtering",
      "path_id": "data_analyst",
      "leaked_concepts": [],
      "unsupported_claims": [],
      "blocking": false
    },
    {
      "concept_id": "spreadsheet.conditional_formatting",
      "path_id": "data_analyst",
      "leaked_concepts": [],
      "unsupported_claims": [],
      "blocking": false
    },
    {
      "concept_id": "spreadsheet.data_validation",
      "path_id": "data_analyst",
      "leaked_concepts": [],
      "unsupported_claims": [],
      "blocking": false
    },
    {
      "concept_id": "spreadsheet.remove_duplicates_cleaning",
      "path_id": "data_analyst",
      "leaked_concepts": [],
      "unsupported_claims": [],
      "blocking": false
    },
    {
      "concept_id": "spreadsheet.text_to_columns_split",
      "path_id": "data_analyst",
      "leaked_concepts": [],
      "unsupported_claims": [],
      "blocking": false
    },
    {
      "concept_id": "spreadsheet.cross_sheet_references",
      "path_id": "data_analyst",
      "leaked_concepts": [],
      "unsupported_claims": [],
      "blocking": false
    },
    {
      "concept_id": "spreadsheet.formula_syntax",
      "path_id": "data_analyst",
      "leaked_concepts": [],
      "unsupported_claims": [],
      "blocking": false
    },
    {
      "concept_id": "spreadsheet.relative_absolute_references",
      "path_id": "data_analyst",
      "leaked_concepts": [],
      "unsupported_claims": [],
      "blocking": false
    },
    {
      "concept_id": "spreadsheet.aggregation_functions",
      "path_id": "data_analyst",
      "leaked_concepts": [],
      "unsupported_claims": [],
      "blocking": false
    },
    {
      "concept_id": "spreadsheet.logical_functions",
      "path_id": "data_analyst",
      "leaked_concepts": [],
      "unsupported_claims": [],
      "blocking": false
    },
    {
      "concept_id": "spreadsheet.text_combining",
      "path_id": "data_analyst",
      "leaked_concepts": [],
      "unsupported_claims": [],
      "blocking": false
    },
    {
      "concept_id": "spreadsheet.text_extraction",
      "path_id": "data_analyst",
      "leaked_concepts": [],
      "unsupported_claims": [],
      "blocking": false
    },
    {
      "concept_id": "spreadsheet.date_functions",
      "path_id": "data_analyst",
      "leaked_concepts": [],
      "unsupported_claims": [],
      "blocking": false
    },
    {
      "concept_id": "spreadsheet.conditional_aggregation",
      "path_id": "data_analyst",
      "leaked_concepts": [],
      "unsupported_claims": [],
      "blocking": false
    },
    {
      "concept_id": "spreadsheet.vlookup_xlookup",
      "path_id": "data_analyst",
      "leaked_concepts": [],
      "unsupported_claims": [],
      "blocking": false
    },
    {
      "concept_id": "spreadsheet.index_match",
      "path_id": "data_analyst",
      "leaked_concepts": [],
      "unsupported_claims": [],
      "blocking": false
    },
    {
      "concept_id": "spreadsheet.formula_error_troubleshooting",
      "path_id": "data_analyst",
      "leaked_concepts": [],
      "unsupported_claims": [],
      "blocking": false
    },
    {
      "concept_id": "spreadsheet.pivot_tables",
      "path_id": "data_analyst",
      "leaked_concepts": [],
      "unsupported_claims": [],
      "blocking": false
    },
    {
      "concept_id": "spreadsheet.pivot_summarization",
      "path_id": "data_analyst",
      "leaked_concepts": [],
      "unsupported_claims": [],
      "blocking": false
    },
    {
      "concept_id": "spreadsheet.bar_chart_creation",
      "path_id": "data_analyst",
      "leaked_concepts": [],
      "unsupported_claims": [],
      "blocking": false
    },
    {
      "concept_id": "spreadsheet.line_chart_creation",
      "path_id": "data_analyst",
      "leaked_concepts": [],
      "unsupported_claims": [],
      "blocking": false
    },
    {
      "concept_id": "spreadsheet.pie_chart_creation",
      "path_id": "data_analyst",
      "leaked_concepts": [],
      "unsupported_claims": [],
      "blocking": false
    },
    {
      "concept_id": "stats.ab_test_structure",
      "path_id": "data_analyst",
      "leaked_concepts": [],
      "unsupported_claims": [],
      "blocking": false
    },
    {
      "concept_id": "stats.lift_interpretation",
      "path_id": "data_analyst",
      "leaked_concepts": [],
      "unsupported_claims": [],
      "blocking": false
    },
    {
      "concept_id": "stats.sample_size_effect_concept",
      "path_id": "data_analyst",
      "leaked_concepts": [],
      "unsupported_claims": [],
      "blocking": false
    },
    {
      "concept_id": "stats.significance_confidence_concept",
      "path_id": "data_analyst",
      "leaked_concepts": [],
      "unsupported_claims": [],
      "blocking": false
    },
    {
      "concept_id": "stats.business_conclusion_from_experiment",
      "path_id": "data_analyst",
      "leaked_concepts": [],
      "unsupported_claims": [],
      "blocking": false
    }
  ],
  "blocking_issue_count": 0
}
