{
  "metadata": {
    "artifact_type": "leakage_audit_report",
    "artifact_version": "1.0.0",
    "schema_version": "1.0.0",
    "batch_id": "glossary_batch_001_data_analyst_pilot",
    "run_id": "glossary_batch_001_data_analyst_pilot",
    "prompt_version": "13_leakage_check@v1",
    "model": "us.anthropic.claude-sonnet-4-6",
    "generated_at": "2026-10-17T11:43:34.669441+00:00",
    "source_snapshot_id": "glossary_batch_001_data_analyst_pilot",
    "parent_artifact_hashes": {
      "glossary_bundles_draft.json": "24d8f09a2ff9b20fd2bcb73f8f3404a3544fc6421e9217937055272765e51c8e",
      "extracted_concepts.json": "8e3969d65e33ee46f6e3ca399cf9ada942a5b349eb85f07e6b5d60dfe6acdc8e"
    }
  },
  "batch_id": "glossary_batch_001_data_analyst_pilot",
  "reviewed_bundle_ids": [
    "python.variables_assignment:data_analyst",
    "python.core_data_types:data_analyst",
    "python.arithmetic_operators:data_analyst",
    "python.comparison_operators:data_analyst",
    "python.logical_operators:data_analyst",
    "python.type_conversion:data_analyst",
    "python.lists:data_analyst",
    "python.dictionaries:data_analyst",
    "python.tuples:data_analyst",
    "python.sets:data_analyst",
    "python.string_basics_formatting:data_analyst",
    "python.conditional_statements:data_analyst",
    "python.for_loops:data_analyst",
    "python.while_loops:data_analyst",
    "python.loop_control:data_analyst",
    "python.comprehensions:data_analyst",
    "python.iterating_collections:data_analyst",
    "python.defining_calling_functions:data_analyst",
    "python.parameters_arguments:data_analyst",
    "python.return_values:data_analyst",
    "python.function_default_keyword_args:data_analyst",
    "python.variable_scope:data_analyst",
    "python.error_handling:data_analyst",
    "python.import_statements:data_analyst",
    "python.file_io:data_analyst",
    "python.pep8_style:data_analyst"
  ],
  "reviews": [
    {
      "concept_id": "python.variables_assignment",
      "path_id": "data_analyst",
      "leaked_concepts": [],
      "unsupported_claims": [],
      "blocking": false
    },
    {
      "concept_id": "python.core_data_types",
      "path_id": "data_analyst",
      "leaked_concepts": [],
      "unsupported_claims": [],
      "blocking": false
    },
    {
      "concept_id": "python.arithmetic_operators",
      "path_id": "data_analyst",
      "leaked_concepts": [],
      "unsupported_claims": [],
      "blocking": false
    },
    {
      "concept_id": "python.comparison_operators",
      "path_id": "data_analyst",
      "leaked_concepts": [],
      "unsupported_claims": [],
      "blocking": false
    },
    {
      "concept_id": "python.logical_operators",
      "path_id": "data_analyst",
      "leaked_concepts": [],
      "unsupported_claims": [],
      "blocking": false
    },
    {
      "concept_id": "python.type_conversion",
      "path_id": "data_analyst",
      "leaked_concepts": [],
      "unsupported_claims": [],
      "blocking": false
    },
    {
      "concept_id": "python.lists",
      "path_id": "data_analyst",
      "leaked_concepts": [],
      "unsupported_claims": [],
      "blocking": false
    },
    {
      "concept_id": "python.dictionaries",
      "path_id": "data_analyst",
      "leaked_concepts": [],
      "unsupported_claims": [],
      "blocking": false
    },
    {
      "concept_id": "python.tuples",
      "path_id": "data_analyst",
      "leaked_concepts": [],
      "unsupported_claims": [],
      "blocking": false
    },
    {
      "concept_id": "python.sets",
      "path_id": "data_analyst",
      "leaked_concepts": [],
      "unsupported_claims": [],
      "blocking": false
    },
    {
      "concept_id": "python.string_basics_formatting",
      "path_id": "data_analyst",
      "leaked_concepts": [],
      "unsupported_claims": [],
      "blocking": false
    },
    {
      "concept_id": "python.conditional_statements",
      "path_id": "data_analyst",
      "leaked_concepts": [],
      "unsupported_claims": [],
      "blocking": false
    },
    {
      "concept_id": "python.for_loops",
      "path_id": "data_analyst",
      "leaked_concepts": [],
      "unsupported_claims": [],
      "blocking": false
    },
    {
      "concept_id": "python.while_loops",
      "path_id": "data_analyst",
      "leaked_concepts": [],
      "unsupported_claims": [],
      "blocking": false
    },
    {
      "concept_id": "python.loop_control",
      "path_id": "data_analyst",
      "leaked_concepts": [],
      "unsupported_claims": [],
      "blocking": false
    },
    {
      "concept_id": "python.comprehensions",
      "path_id": "data_analyst",
      "leaked_concepts": [],
      "unsupported_claims": [],
      "blocking": false
    },
    {
      "concept_id": "python.iterating_collections",
      "path_id": "data_analyst",
      "leaked_concepts": [],
      "unsupported_claims": [],
      "blocking": false
    },
    {
      "concept_id": "python.defining_calling_functions",
      "path_id": "data_analyst",
      "leaked_concepts": [],
      "unsupported_claims": [],
      "blocking": false
    },
    {
      "concept_id": "python.parameters_arguments",
      "path_id": "data_analyst",
      "leaked_concepts": [],
      "unsupported_claims": [],
      "blocking": false
    },
    {
      "concept_id": "python.return_values",
      "path_id": "data_analyst",
      "leaked_concepts": [],
      "unsupported_claims": [],
      "blocking": false
    },
    {
      "concept_id": "python.function_default_keyword_args",
      "path_id": "data_analyst",
      "leaked_concepts": [],
      "unsupported_claims": [],
      "blocking": false
    },
    {
      "concept_id": "python.variable_scope",
      "path_id": "data_analyst",
      "leaked_concepts": [],
      "unsupported_claims": [],
      "blocking": false
    },
    {
      "concept_id": "python.error_handling",
      "path_id": "data_analyst",
      "leaked_concepts": [],
      "unsupported_claims": [],
      "blocking": false
    },
    {
      "concept_id": "python.import_statements",
      "path_id": "data_analyst",
      "leaked_concepts": [],
      "unsupported_claims": [],
      "blocking": false
    },
    {
      "concept_id": "python.file_io",
      "path_id": "data_analyst",
      "leaked_concepts": [],
      "unsupported_claims": [],
      "blocking": false
    },
    {
      "concept_id": "python.pep8_style",
      "path_id": "data_analyst",
      "leaked_concepts": [],
      "unsupported_claims": [],
      "blocking": false
    }
  ],
  "blocking_issue_count": 0
}