{
  "metadata": {
    "artifact_type": "leakage_audit_report",
    "artifact_version": "1.0.0",
    "schema_version": "1.0.0",
    "batch_id": "glossary_batch_001_data_analyst_pilot",
    "run_id": "glossary_batch_001_data_analyst_pilot_13_c2",
    "prompt_version": "13_leakage_check@v1",
    "model": "us.anthropic.claude-sonnet-4-6",
    "generated_at": "2026-10-17T12:00:00Z",
    "source_snapshot_id": "glossary_batch_001_data_analyst_pilot",
    "parent_artifact_hashes": {
      "glossary_bundles_draft.part.c2.json": "2439b290e4b8e7c65ea8e24676b9412d44f47619df6266b6f281c730dfd06acb",
      "extracted_concepts.json": "8e3969d65e33ee46f6e3ca399cf9ada942a5b349eb85f07e6b5d60dfe6acdc8e"
    }
  },
  "batch_id": "glossary_batch_001_data_analyst_pilot",
  "reviewed_bundle_ids": [
    "stats.descriptive_measures_of_center:data_analyst",
    "stats.measures_of_spread:data_analyst",
    "stats.distribution_shape:data_analyst",
    "stats.outlier_reasoning:data_analyst",
    "stats.frequency_distribution_reading:data_analyst",
    "stats.correlation:data_analyst",
    "stats.correlation_interpretation:data_analyst",
    "stats.correlation_vs_causation_caveat:data_analyst",
    "pandas.dataframe_series_model:data_analyst",
    "pandas.reading_data:data_analyst",
    "pandas.creating_dataframes:data_analyst",
    "pandas.inspecting_dataframes:data_analyst",
    "stats.pandas_descriptive_stats:data_analyst",
    "pandas.loc_iloc_selection:data_analyst",
    "pandas.boolean_filtering:data_analyst",
    "pandas.sort_values:data_analyst",
    "pandas.rename_columns_index:data_analyst",
    "pandas.dtype_conversion:data_analyst",
    "pandas.datetime_handling:data_analyst",
    "pandas.str_accessor_cleaning:data_analyst",
    "pandas.drop_duplicates:data_analyst",
    "pandas.missing_data_handling:data_analyst",
    "pandas.map_substitution:data_analyst",
    "pandas.apply_transform:data_analyst",
    "pandas.concat_stacking:data_analyst",
    "pandas.merge_join:data_analyst",
    "pandas.groupby_aggregation:data_analyst",
    "pandas.melt_reshaping:data_analyst",
    "pandas.pivot_table_reshaping:data_analyst",
    "pandas.export_to_csv:data_analyst"
  ],
  "reviews": [
    {
      "concept_id": "stats.descriptive_measures_of_center",
      "path_id": "data_analyst",
      "leaked_concepts": [],
      "unsupported_claims": [],
      "blocking": false
    },
    {
      "concept_id": "stats.measures_of_spread",
      "path_id": "data_analyst",
      "leaked_concepts": [],
      "unsupported_claims": [],
      "blocking": false
    },
    {
      "concept_id": "stats.distribution_shape",
      "path_id": "data_analyst",
      "leaked_concepts": [],
      "unsupported_claims": [],
      "blocking": false
    },
    {
      "concept_id": "stats.outlier_reasoning",
      "path_id": "data_analyst",
      "leaked_concepts": [],
      "unsupported_claims": [],
      "blocking": false
    },
    {
      "concept_id": "stats.frequency_distribution_reading",
      "path_id": "data_analyst",
      "leaked_concepts": [],
      "unsupported_claims": [],
      "blocking": false
    },
    {
      "concept_id": "stats.correlation",
      "path_id": "data_analyst",
      "leaked_concepts": [],
      "unsupported_claims": [],
      "blocking": false
    },
    {
      "concept_id": "stats.correlation_interpretation",
      "path_id": "data_analyst",
      "leaked_concepts": [],
      "unsupported_claims": [],
      "blocking": false
    },
    {
      "concept_id": "stats.correlation_vs_causation_caveat",
      "path_id": "data_analyst",
      "leaked_concepts": [],
      "unsupported_claims": [],
      "blocking": false
    },
    {
      "concept_id": "pandas.dataframe_series_model",
      "path_id": "data_analyst",
      "leaked_concepts": [],
      "unsupported_claims": [],
      "blocking": false
    },
    {
      "concept_id": "pandas.reading_data",
      "path_id": "data_analyst",
      "leaked_concepts": [],
      "unsupported_claims": [],
      "blocking": false
    },
    {
      "concept_id": "pandas.creating_dataframes",
      "path_id": "data_analyst",
      "leaked_concepts": [],
      "unsupported_claims": [],
      "blocking": false
    },
    {
      "concept_id": "pandas.inspecting_dataframes",
      "path_id": "data_analyst",
      "leaked_concepts": [],
      "unsupported_claims": [],
      "blocking": false
    },
    {
      "concept_id": "stats.pandas_descriptive_stats",
      "path_id": "data_analyst",
      "leaked_concepts": [],
      "unsupported_claims": [],
      "blocking": false
    },
    {
      "concept_id": "pandas.loc_iloc_selection",
      "path_id": "data_analyst",
      "leaked_concepts": [],
      "unsupported_claims": [],
      "blocking": false
    },
    {
      "concept_id": "pandas.boolean_filtering",
      "path_id": "data_analyst",
      "leaked_concepts": [],
      "unsupported_claims": [],
      "blocking": false
    },
    {
      "concept_id": "pandas.sort_values",
      "path_id": "data_analyst",
      "leaked_concepts": [],
      "unsupported_claims": [],
      "blocking": false
    },
    {
      "concept_id": "pandas.rename_columns_index",
      "path_id": "data_analyst",
      "leaked_concepts": [],
      "unsupported_claims": [],
      "blocking": false
    },
    {
      "concept_id": "pandas.dtype_conversion",
      "path_id": "data_analyst",
      "leaked_concepts": [],
      "unsupported_claims": [],
      "blocking": false
    },
    {
      "concept_id": "pandas.datetime_handling",
      "path_id": "data_analyst",
      "leaked_concepts": [],
      "unsupported_claims": [],
      "blocking": false
    },
    {
      "concept_id": "pandas.str_accessor_cleaning",
      "path_id": "data_analyst",
      "leaked_concepts": [],
      "unsupported_claims": [],
      "blocking": false
    },
    {
      "concept_id": "pandas.drop_duplicates",
      "path_id": "data_analyst",
      "leaked_concepts": [],
      "unsupported_claims": [],
      "blocking": false
    },
    {
      "concept_id": "pandas.missing_data_handling",
      "path_id": "data_analyst",
      "leaked_concepts": [],
      "unsupported_claims": [],
      "blocking": false
    },
    {
      "concept_id": "pandas.map_substitution",
      "path_id": "data_analyst",
      "leaked_concepts": [],
      "unsupported_claims": [],
      "blocking": false
    },
    {
      "concept_id": "pandas.apply_transform",
      "path_id": "data_analyst",
      "leaked_concepts": [],
      "unsupported_claims": [],
      "blocking": false
    },
    {
      "concept_id": "pandas.concat_stacking",
      "path_id": "data_analyst",
      "leaked_concepts": [],
      "unsupported_claims": [],
      "blocking": false
    },
    {
      "concept_id": "pandas.merge_join",
      "path_id": "data_analyst",
      "leaked_concepts": [],
      "unsupported_claims": [],
      "blocking": false
    },
    {
      "concept_id": "pandas.groupby_aggregation",
      "path_id": "data_analyst",
      "leaked_concepts": [],
      "unsupported_claims": [],
      "blocking": false
    },
    {
      "concept_id": "pandas.melt_reshaping",
      "path_id": "data_analyst",
      "leaked_concepts": [],
      "unsupported_claims": [],
      "blocking": false
    },
    {
      "concept_id": "pandas.pivot_table_reshaping",
      "path_id": "data_analyst",
      "leaked_concepts": [],
      "unsupported_claims": [],
      "blocking": false
    },
    {
      "concept_id": "pandas.export_to_csv",
      "path_id": "data_analyst",
      "leaked_concepts": [],
      "unsupported_claims": [],
      "blocking": false
    }
  ],
  "blocking_issue_count": 0
}