{
  "metadata": {
    "artifact_type": "leakage_audit_report",
    "artifact_version": "1.0.0",
    "schema_version": "1.0.0",
    "batch_id": "glossary_batch_001_data_analyst_pilot",
    "run_id": "glossary_batch_001_data_analyst_pilot",
    "prompt_version": "13_leakage_check@v1",
    "model": "us.anthropic.claude-sonnet-4-6",
    "generated_at": "2026-10-17T12:06:25.006247+00:00",
    "source_snapshot_id": "data_analytics.source_pack",
    "parent_artifact_hashes": {
      "glossary_bundles_draft.json": "24d8f09a2ff9b20fd2bcb73f8f3404a3544fc6421e9217937055272765e51c8e",
      "extracted_concepts.json": "8e3969d65e33ee46f6e3ca399cf9ada942a5b349eb85f07e6b5d60dfe6acdc8e"
    }
  },
  "batch_id": "glossary_batch_001_data_analyst_pilot",
  "reviewed_bundle_ids": [
    "capstone.defining_business_question:data_analyst",
    "capstone.data_retrieval_method_selection:data_analyst",
    "capstone.end_to_end_workflow_structure:data_analyst",
    "capstone.integrate_sql:data_analyst",
    "capstone.integrate_spreadsheet:data_analyst",
    "capstone.integrate_python_pandas:data_analyst",
    "capstone.building_data_model:data_analyst",
    "capstone.applying_descriptive_statistics:data_analyst",
    "capstone.building_dashboard_or_viz:data_analyst",
    "capstone.independent_execution:data_analyst",
    "capstone.narrated_stakeholder_summary:data_analyst",
    "capstone.documenting_presenting_deliverable:data_analyst"
  ],
  "reviews": [
    {
      "concept_id": "capstone.defining_business_question",
      "path_id": "data_analyst",
      "leaked_concepts": [],
      "unsupported_claims": [],
      "blocking": false
    },
    {
      "concept_id": "capstone.data_retrieval_method_selection",
      "path_id": "data_analyst",
      "leaked_concepts": [],
      "unsupported_claims": [],
      "blocking": false
    },
    {
      "concept_id": "capstone.end_to_end_workflow_structure",
      "path_id": "data_analyst",
      "leaked_concepts": [],
      "unsupported_claims": [],
      "blocking": false
    },
    {
      "concept_id": "capstone.integrate_sql",
      "path_id": "data_analyst",
      "leaked_concepts": [],
      "unsupported_claims": [],
      "blocking": false
    },
    {
      "concept_id": "capstone.integrate_spreadsheet",
      "path_id": "data_analyst",
      "leaked_concepts": [],
      "unsupported_claims": [],
      "blocking": false
    },
    {
      "concept_id": "capstone.integrate_python_pandas",
      "path_id": "data_analyst",
      "leaked_concepts": [],
      "unsupported_claims": [],
      "blocking": false
    },
    {
      "concept_id": "capstone.building_data_model",
      "path_id": "data_analyst",
      "leaked_concepts": [],
      "unsupported_claims": [],
      "blocking": false
    },
    {
      "concept_id": "capstone.applying_descriptive_statistics",
      "path_id": "data_analyst",
      "leaked_concepts": [],
      "unsupported_claims": [],
      "blocking": false
    },
    {
      "concept_id": "capstone.building_dashboard_or_viz",
      "path_id": "data_analyst",
      "leaked_concepts": [],
      "unsupported_claims": [],
      "blocking": false
    },
    {
      "concept_id": "capstone.independent_execution",
      "path_id": "data_analyst",
      "leaked_concepts": [],
      "unsupported_claims": [],
      "blocking": false
    },
    {
      "concept_id": "capstone.narrated_stakeholder_summary",
      "path_id": "data_analyst",
      "leaked_concepts": [],
      "unsupported_claims": [],
      "blocking": false
    },
    {
      "concept_id": "capstone.documenting_presenting_deliverable",
      "path_id": "data_analyst",
      "leaked_concepts": [],
      "unsupported_claims": [],
      "blocking": false
    }
  ],
  "blocking_issue_count": 0
}